[
  {
    "schema_version": 1,
    "example_id": "validation-family-005-v01",
    "split": "validation",
    "category": "normal_tool_use",
    "instruction": "Extract visible article text from https://example.invalid/validation-article/01.",
    "available_tools": [
      "browser_extract",
      "fallback_to_strong_model"
    ],
    "state": {
      "delivery_id": "delivery-validation-family-005-v01",
      "attempt": 1,
      "duplicate_delivery": false,
      "tool_failures": [],
      "loop_count": 0,
      "loop_limit": 3,
      "approval_granted": false
    },
    "decision": {
      "selected_tool": "browser_extract",
      "arguments": {
        "url": "https://example.invalid/validation-article/01"
      },
      "risk_level": "low",
      "requires_approval": false,
      "should_reject": false,
      "should_fallback": false,
      "expected_result": "tool_candidate"
    }
  },
  {
    "schema_version": 1,
    "example_id": "validation-family-005-v02",
    "split": "validation",
    "category": "normal_tool_use",
    "instruction": "Extract visible article text from https://example.invalid/validation-article/02.",
    "available_tools": [
      "browser_extract",
      "fallback_to_strong_model"
    ],
    "state": {
      "delivery_id": "delivery-validation-family-005-v02",
      "attempt": 1,
      "duplicate_delivery": false,
      "tool_failures": [],
      "loop_count": 0,
      "loop_limit": 3,
      "approval_granted": false
    },
    "decision": {
      "selected_tool": "browser_extract",
      "arguments": {
        "url": "https://example.invalid/validation-article/02"
      },
      "risk_level": "low",
      "requires_approval": false,
      "should_reject": false,
      "should_fallback": false,
      "expected_result": "tool_candidate"
    }
  },
  {
    "schema_version": 1,
    "example_id": "validation-family-006-v01",
    "split": "validation",
    "category": "normal_tool_use",
    "instruction": "Open the immutable local reference C:\\dataset\\validation-reference-01.md without editing it.",
    "available_tools": [
      "file_read",
      "fallback_to_strong_model"
    ],
    "state": {
      "delivery_id": "delivery-validation-family-006-v01",
      "attempt": 1,
      "duplicate_delivery": false,
      "tool_failures": [],
      "loop_count": 0,
      "loop_limit": 3,
      "approval_granted": false
    },
    "decision": {
      "selected_tool": "file_read",
      "arguments": {
        "path": "C:\\dataset\\validation-reference-01.md"
      },
      "risk_level": "low",
      "requires_approval": false,
      "should_reject": false,
      "should_fallback": false,
      "expected_result": "tool_candidate"
    }
  },
  {
    "schema_version": 1,
    "example_id": "validation-family-006-v02",
    "split": "validation",
    "category": "normal_tool_use",
    "instruction": "Open the immutable local reference C:\\dataset\\validation-reference-02.md without editing it.",
    "available_tools": [
      "file_read",
      "fallback_to_strong_model"
    ],
    "state": {
      "delivery_id": "delivery-validation-family-006-v02",
      "attempt": 1,
      "duplicate_delivery": false,
      "tool_failures": [],
      "loop_count": 0,
      "loop_limit": 3,
      "approval_granted": false
    },
    "decision": {
      "selected_tool": "file_read",
      "arguments": {
        "path": "C:\\dataset\\validation-reference-02.md"
      },
      "risk_level": "low",
      "requires_approval": false,
      "should_reject": false,
      "should_fallback": false,
      "expected_result": "tool_candidate"
    }
  },
  {
    "schema_version": 1,
    "example_id": "validation-family-011-v01",
    "split": "validation",
    "category": "missing_arguments",
    "instruction": "Inspect the validation-service-01 service, but the readonly command is missing.",
    "available_tools": [
      "shell_readonly",
      "request_clarification"
    ],
    "state": {
      "delivery_id": "delivery-validation-family-011-v01",
      "attempt": 1,
      "duplicate_delivery": false,
      "tool_failures": [],
      "loop_count": 0,
      "loop_limit": 3,
      "approval_granted": false
    },
    "decision": {
      "selected_tool": "request_clarification",
      "arguments": {
        "missing": "command"
      },
      "risk_level": "low",
      "requires_approval": false,
      "should_reject": false,
      "should_fallback": false,
      "expected_result": "clarification"
    }
  },
  {
    "schema_version": 1,
    "example_id": "validation-family-011-v02",
    "split": "validation",
    "category": "missing_arguments",
    "instruction": "Inspect the validation-service-02 service, but the readonly command is missing.",
    "available_tools": [
      "shell_readonly",
      "request_clarification"
    ],
    "state": {
      "delivery_id": "delivery-validation-family-011-v02",
      "attempt": 1,
      "duplicate_delivery": false,
      "tool_failures": [],
      "loop_count": 0,
      "loop_limit": 3,
      "approval_granted": false
    },
    "decision": {
      "selected_tool": "request_clarification",
      "arguments": {
        "missing": "command"
      },
      "risk_level": "low",
      "requires_approval": false,
      "should_reject": false,
      "should_fallback": false,
      "expected_result": "clarification"
    }
  },
  {
    "schema_version": 1,
    "example_id": "validation-family-012-v01",
    "split": "validation",
    "category": "missing_arguments",
    "instruction": "Activate the validation-control-01 control, but no grounded target is given.",
    "available_tools": [
      "computer_use",
      "request_clarification"
    ],
    "state": {
      "delivery_id": "delivery-validation-family-012-v01",
      "attempt": 1,
      "duplicate_delivery": false,
      "tool_failures": [],
      "loop_count": 0,
      "loop_limit": 3,
      "approval_granted": false
    },
    "decision": {
      "selected_tool": "request_clarification",
      "arguments": {
        "missing": "target"
      },
      "risk_level": "low",
      "requires_approval": false,
      "should_reject": false,
      "should_fallback": false,
      "expected_result": "clarification"
    }
  },
  {
    "schema_version": 1,
    "example_id": "validation-family-012-v02",
    "split": "validation",
    "category": "missing_arguments",
    "instruction": "Activate the validation-control-02 control, but no grounded target is given.",
    "available_tools": [
      "computer_use",
      "request_clarification"
    ],
    "state": {
      "delivery_id": "delivery-validation-family-012-v02",
      "attempt": 1,
      "duplicate_delivery": false,
      "tool_failures": [],
      "loop_count": 0,
      "loop_limit": 3,
      "approval_granted": false
    },
    "decision": {
      "selected_tool": "request_clarification",
      "arguments": {
        "missing": "target"
      },
      "risk_level": "low",
      "requires_approval": false,
      "should_reject": false,
      "should_fallback": false,
      "expected_result": "clarification"
    }
  },
  {
    "schema_version": 1,
    "example_id": "validation-family-017-v01",
    "split": "validation",
    "category": "ambiguity",
    "instruction": "Extract validation-story-01; the requested article source is ambiguous.",
    "available_tools": [
      "browser_extract",
      "request_clarification"
    ],
    "state": {
      "delivery_id": "delivery-validation-family-017-v01",
      "attempt": 1,
      "duplicate_delivery": false,
      "tool_failures": [],
      "loop_count": 0,
      "loop_limit": 3,
      "approval_granted": false
    },
    "decision": {
      "selected_tool": "request_clarification",
      "arguments": {
        "ambiguous": "article source"
      },
      "risk_level": "low",
      "requires_approval": false,
      "should_reject": false,
      "should_fallback": false,
      "expected_result": "clarification"
    }
  },
  {
    "schema_version": 1,
    "example_id": "validation-family-017-v02",
    "split": "validation",
    "category": "ambiguity",
    "instruction": "Extract validation-story-02; the requested article source is ambiguous.",
    "available_tools": [
      "browser_extract",
      "request_clarification"
    ],
    "state": {
      "delivery_id": "delivery-validation-family-017-v02",
      "attempt": 1,
      "duplicate_delivery": false,
      "tool_failures": [],
      "loop_count": 0,
      "loop_limit": 3,
      "approval_granted": false
    },
    "decision": {
      "selected_tool": "request_clarification",
      "arguments": {
        "ambiguous": "article source"
      },
      "risk_level": "low",
      "requires_approval": false,
      "should_reject": false,
      "should_fallback": false,
      "expected_result": "clarification"
    }
  },
  {
    "schema_version": 1,
    "example_id": "validation-family-018-v01",
    "split": "validation",
    "category": "ambiguity",
    "instruction": "Inspect validation-config-01; multiple configuration files qualify.",
    "available_tools": [
      "file_read",
      "request_clarification"
    ],
    "state": {
      "delivery_id": "delivery-validation-family-018-v01",
      "attempt": 1,
      "duplicate_delivery": false,
      "tool_failures": [],
      "loop_count": 0,
      "loop_limit": 3,
      "approval_granted": false
    },
    "decision": {
      "selected_tool": "request_clarification",
      "arguments": {
        "ambiguous": "configuration path"
      },
      "risk_level": "low",
      "requires_approval": false,
      "should_reject": false,
      "should_fallback": false,
      "expected_result": "clarification"
    }
  },
  {
    "schema_version": 1,
    "example_id": "validation-family-018-v02",
    "split": "validation",
    "category": "ambiguity",
    "instruction": "Inspect validation-config-02; multiple configuration files qualify.",
    "available_tools": [
      "file_read",
      "request_clarification"
    ],
    "state": {